<?xml version="1.0" encoding="UTF-8"?>
<stores xmlns="http://www.armedia.com/ns/caliente/stores"
	xmlns:xsi="http://www.w3.org/2001/XMLSchema-instance"
	xsi:schemaLocation="http://www.armedia.com/ns/caliente/stores platform:/resource/caliente-store/src/main/resources/stores.xsd">
	<settings>
		<setting name="target">${user.dir}/target/test-db</setting>
		<setting name="db.name">cmis-test</setting>
		<setting name="dir.metadata">${target}</setting>
		<setting name="dir.content">${target}/content</setting>
		<setting name="dir.content.organizer">cmis</setting>
	</settings>

	<objectstore id="default">
		<type>jdbc</type>
		<settings>
			<setting name="location.type">pooled</setting>
			<setting name="jdbc.url">jdbc:h2:${dir.metadata}/${db.name};AUTO_SERVER=TRUE;MODE=PostgreSQL;PAGE_SIZE=4096</setting>
			<setting name="jdbc.driver">org.h2.Driver</setting>
		</settings>
	</objectstore>

	<contentstore id="default">
		<type>local</type>
		<settings>
			<setting name="base.dir">${dir.content}</setting>
			<setting name="uri.organizer">${dir.content.organizer}</setting>
			<setting name="force.safe.filenames">false</setting>
			<setting name="safe.filename.encoding">UTF-8</setting>
			<setting name="fix.filenames">true</setting>
			<setting name="fail.on.collisions">false</setting>
			<setting name="ignore.extra.filename.info">false</setting>
			<setting name="use.windows.fix">true</setting>
		</settings>
	</contentstore>
</stores>